{
  "schemaVersion": 1,
  "benchmarkId": "GS-OSS-2026-08-01-V5",
  "evidenceClass": "external-observational",
  "taskId": "TASK-OSS-01",
  "repository": "immich-app/immich",
  "status": "NOT_RUN",
  "upstreamBaseCommit": "834cc54abcc4127ee13a127ade2e2f467d46c063",
  "sealedSeedCommit": "15ba6bed78feebe392dfbe13cf0be4065b260af7",
  "sealedSeedTreeSha256": "3ebafacc713e37ea6939f08b1205198b415c5ae62dcbddb9f11ce4ab732ee70e",
  "taskSeedContractSha256": "07a38afcdc6cd46b1509df0bccb3d6941f3a95e137aa2de1f6293b3b91d73887",
  "cacheSha256": null,
  "manifestSha256": null,
  "cacheFilesSha256": null,
  "runtimeIdentity": {},
  "preparationNetworkUsed": null,
  "measuredNetworkUsed": null,
  "cacheReadOnlyObserved": null,
  "publicTestSmokePass": null,
  "negativeCacheMissBlocked": null,
  "containmentObserved": null,
  "lockfileModified": null,
  "credentialIncluded": null,
  "fallbackDownload": null,
  "limitations": ["Template only; no preparation, offline smoke, or cache artifact exists."]
}
