{
  "schemaVersion": 1,
  "benchmarkId": "GS-OSS-2026-08-01-V5",
  "evidenceClass": "external-observational",
  "taskId": "TASK-OSS-03",
  "repository": "louislam/uptime-kuma",
  "status": "NOT_RUN",
  "upstreamBaseCommit": "efa194a6df72572e5245a25794bdad7ad34bea2d",
  "sealedSeedCommit": "672d8d324fde3a0d874ee752ab8e1ef4751972bb",
  "sealedSeedTreeSha256": "5fdbf067da484e3778a1345297a33d984779be73c020ded93198a1c84f5a07ca",
  "taskSeedContractSha256": "6ca94ddef9e6f2e8a7acaa5da7733aacddd426e6313b4bf800d8cd68a35ead15",
  "cacheSha256": null,
  "manifestSha256": null,
  "cacheFilesSha256": null,
  "runtimeIdentity": {},
  "preparationNetworkUsed": null,
  "measuredNetworkUsed": null,
  "cacheReadOnlyObserved": null,
  "publicTestSmokePass": null,
  "negativeCacheMissBlocked": null,
  "containmentObserved": null,
  "lockfileModified": null,
  "credentialIncluded": null,
  "fallbackDownload": null,
  "limitations": ["Template only; no preparation, offline smoke, or cache artifact exists."]
}
