{
  "schemaVersion": 1,
  "benchmarkId": "GS-OSS-2026-08-01-V5",
  "evidenceClass": "external-observational",
  "taskId": "TASK-OSS-09",
  "repository": "paperless-ngx/paperless-ngx",
  "status": "NOT_RUN",
  "upstreamBaseCommit": "fb3816486cf9fac6bcc23a82200f632a6f1b6ce8",
  "sealedSeedCommit": "17562a35c7b3ebf87e0c960306af6de39c79248b",
  "sealedSeedTreeSha256": "64d046e9abad54f4f10d2e489d4385e5ca6df1e0d5b8d67ecf48ad560bf4ad42",
  "taskSeedContractSha256": "9735771f442b4962b83c8c7323c2707f30e570f27202ac86d4db810876cd98d3",
  "cacheSha256": null,
  "manifestSha256": null,
  "cacheFilesSha256": null,
  "runtimeIdentity": {},
  "preparationNetworkUsed": null,
  "measuredNetworkUsed": null,
  "cacheReadOnlyObserved": null,
  "publicTestSmokePass": null,
  "negativeCacheMissBlocked": null,
  "containmentObserved": null,
  "lockfileModified": null,
  "credentialIncluded": null,
  "fallbackDownload": null,
  "limitations": ["Template only; no preparation, offline smoke, or cache artifact exists."]
}
